{
  "brand": "Inkbird",
  "series": "ICC",
  "model": "ICC-500T",
  "revision": null,
  "status": "active",
  "controller_type": "co2_controller",
  "controller_role": "primary",
  "system_category": "standalone",
  "supported_devices": "CO2 generators, CO2 regulators, exhaust fans",
  "max_device_count": 2,
  "max_ports": 2,
  "port_types": "2x EU outlet (WORK1 CO2 source, WORK2 exhaust fan), CO2 sensor port",
  "plug_type": "EU",
  "output_voltage_v": null,
  "max_load_watts": null,
  "max_load_amps": 10,
  "sensor_temperature": false,
  "sensor_humidity": false,
  "sensor_vpd": false,
  "sensor_co2": true,
  "sensor_light": false,
  "sensor_soil_moisture": false,
  "sensor_water_temp": false,
  "sensor_ph": false,
  "sensor_ec": false,
  "sensor_level": false,
  "sensor_pressure": false,
  "control_temperature": false,
  "control_humidity": false,
  "control_vpd": false,
  "control_fan_speed": false,
  "control_light_schedule": false,
  "control_light_dimming": false,
  "control_ir_uv": false,
  "control_co2": true,
  "control_irrigation": false,
  "control_ph": false,
  "control_ec": false,
  "control_heater": false,
  "control_dehumidifier": false,
  "control_humidifier": false,
  "control_pump": false,
  "app_control": false,
  "wifi": false,
  "bluetooth": false,
  "cloud_required": false,
  "local_control": true,
  "api_available": false,
  "mqtt_available": false,
  "automation_rules": "partial",
  "data_logging": false,
  "alerts": true,
  "display_included": true,
  "touchscreen": false,
  "firmware_updates": "unknown",
  "ai_features": false,
  "ai_feature_type": "none",
  "ai_grow_assistant": false,
  "ai_climate_optimization": false,
  "ai_vpd_optimization": false,
  "ai_light_schedule_optimization": false,
  "ai_irrigation_optimization": false,
  "ai_nutrient_recommendations": false,
  "ai_anomaly_detection": false,
  "ai_alert_summarization": false,
  "ai_camera_analysis": false,
  "ai_plant_stage_detection": false,
  "ai_pest_detection": false,
  "ai_disease_detection": false,
  "ai_yield_prediction": false,
  "ai_training_recommendations": false,
  "ai_voice_assistant": false,
  "ai_requires_cloud": false,
  "ai_requires_subscription": false,
  "ai_data_export": false,
  "ai_notes": null,
  "compatible_ec_fans": null,
  "compatible_lights": null,
  "compatible_sensors": "Inkbird S01 NDIR CO2 sensor, Inkbird B01 NDIR CO2 sensor",
  "compatible_humidifiers": null,
  "compatible_irrigation": null,
  "compatible_co2_equipment": "any CO2 regulator or generator",
  "compatible_brand_ecosystem": "any",
  "supported_manufacturer_series": null,
  "power_supply_included": false,
  "mounting_type": "desktop",
  "length_mm": null,
  "width_mm": null,
  "height_mm": null,
  "weight_kg": null,
  "recommended_tent_min_cm": null,
  "recommended_tent_max_cm": null,
  "recommended_use_note": "Standalone CO2 controller for grow rooms and greenhouses. Dual relay controls CO2 source and exhaust fan simultaneously. Requires Inkbird S01 or B01 NDIR CO2 sensor (included in standard bundle). Dual display shows measured and set CO2 simultaneously.",
  "include_in_default_controller_calculator": true,
  "source_url": "https://www.inkbird.com/products/programmable-co-controller-icc-500t",
  "source_type": "manufacturer",
  "source_date": "2026-06-28",
  "confidence_level": "B",
  "uvp_amount": 159.99,
  "uvp_currency": "EUR",
  "uvp_source_url": "https://eu.inkbird.com/products/programmable-co-controller-icc-500t",
  "uvp_source_type": "manufacturer",
  "uvp_source_date": "2026-06-28",
  "uvp_confidence_level": "A",
  "uvp_notes": "Price includes S01 NDIR CO2 sensor. Also available bundled with B01 sensor.",
  "notes": "NDIR CO2 sensing; range 0–9999 ppm; accuracy ±(30 ppm + 3% MV). Sensor warm-up/stabilization ~120 s after power-on. Dual relay: WORK1 for CO2 source, WORK2 for exhaust fan. CE & FCC certified. Also available in UK, AU, and US plug versions. Package gross weight ~0.65 kg (package 20×9×11 cm; device dimensions not found in manufacturer sources)."
}