{
  "brand": "TrolMaster",
  "series": "Carbon-X",
  "model": "Carbon-X",
  "revision": "CDA-1",
  "status": "active",
  "controller_type": "co2_controller",
  "controller_role": "primary",
  "system_category": "app_ecosystem",
  "supported_devices": "CO2 solenoid valves, ventilation fans, dampers, audio-visual alarm modules, fire alarm panel relay",
  "max_device_count": 40,
  "max_ports": null,
  "port_types": "RJ12",
  "plug_type": null,
  "output_voltage_v": null,
  "max_load_watts": null,
  "max_load_amps": null,
  "sensor_temperature": false,
  "sensor_humidity": false,
  "sensor_vpd": false,
  "sensor_co2": true,
  "sensor_light": false,
  "sensor_soil_moisture": false,
  "sensor_water_temp": false,
  "sensor_ph": false,
  "sensor_ec": false,
  "sensor_level": false,
  "sensor_pressure": false,
  "control_temperature": false,
  "control_humidity": false,
  "control_vpd": false,
  "control_fan_speed": "partial",
  "control_light_schedule": false,
  "control_light_dimming": false,
  "control_ir_uv": false,
  "control_co2": true,
  "control_irrigation": false,
  "control_ph": false,
  "control_ec": false,
  "control_heater": false,
  "control_dehumidifier": false,
  "control_humidifier": false,
  "control_pump": false,
  "app_control": true,
  "wifi": false,
  "bluetooth": false,
  "cloud_required": false,
  "local_control": true,
  "api_available": "unknown",
  "mqtt_available": "unknown",
  "automation_rules": true,
  "data_logging": "unknown",
  "alerts": true,
  "display_included": "unknown",
  "touchscreen": false,
  "firmware_updates": true,
  "ai_features": false,
  "ai_feature_type": "none",
  "ai_grow_assistant": false,
  "ai_climate_optimization": false,
  "ai_vpd_optimization": false,
  "ai_light_schedule_optimization": false,
  "ai_irrigation_optimization": false,
  "ai_nutrient_recommendations": false,
  "ai_anomaly_detection": false,
  "ai_alert_summarization": false,
  "ai_camera_analysis": false,
  "ai_plant_stage_detection": false,
  "ai_pest_detection": false,
  "ai_disease_detection": false,
  "ai_yield_prediction": false,
  "ai_training_recommendations": false,
  "ai_voice_assistant": false,
  "ai_requires_cloud": false,
  "ai_requires_subscription": false,
  "ai_data_export": false,
  "ai_notes": null,
  "compatible_ec_fans": null,
  "compatible_lights": null,
  "compatible_sensors": "MBS-K30 CO2 sensors (up to 13 per alarm channel; 2 channels AL-1 and AL-2)",
  "compatible_humidifiers": null,
  "compatible_irrigation": null,
  "compatible_co2_equipment": "CO2 solenoid emergency stop (DSE-1), ventilation fans/dampers via DSC-1 (120V outlet), dry contact relay via DSD-1",
  "compatible_brand_ecosystem": "TrolMaster",
  "supported_manufacturer_series": null,
  "power_supply_included": true,
  "mounting_type": "wall_mount",
  "length_mm": 275,
  "width_mm": 164,
  "height_mm": 62,
  "weight_kg": 1.08,
  "recommended_tent_min_cm": null,
  "recommended_tent_max_cm": null,
  "recommended_use_note": "CO2 safety alarm system for commercial grows using supplemental CO2; monitors up to 13 zones per channel across 2 channels; not a CO2 regulation controller — designed for worker safety compliance",
  "include_in_default_controller_calculator": true,
  "source_url": "https://www.trolmaster.com/Products/Details/CDA-1",
  "source_type": "manufacturer",
  "source_date": "2026-06-28",
  "confidence_level": "B",
  "uvp_amount": 567.75,
  "uvp_currency": "EUR",
  "uvp_source_url": "https://www.higarden.eu/trolmaster/trolmaster-carbon-x-controller--amp--cable-set--cda-1-/",
  "uvp_source_type": "retailer",
  "uvp_source_date": "2026-06-28",
  "uvp_confidence_level": "C",
  "uvp_notes": "Higarden.eu (EU retailer) €567.75 incl. VAT; Growberg.de shows €656.00; US price ~$523 USD",
  "notes": "CO2 safety alarm system — monitors and shuts down CO2 flow when dangerous PPM levels detected; dual-level alerts (low: 3,000–15,000 ppm; high: 15,000–30,000 ppm); integrates with fire alarm panels via dry contact; app for remote alerts only; firmware updates via micro-SD card; not compatible with HughesNet/Viasat satellite internet; Amazon.com ASIN B085J28DKZ (US only)"
}