{
  "brand": "SMSCOM",
  "series": "NutriMatic",
  "model": "NutriMatic Mk2",
  "revision": "Mk2",
  "status": "active",
  "controller_type": "irrigation_controller",
  "controller_role": "primary",
  "system_category": "standalone",
  "supported_devices": "irrigation pumps, drip systems",
  "max_device_count": 1,
  "max_ports": 1,
  "port_types": "Schuko outlet (pump output)",
  "plug_type": "EU",
  "output_voltage_v": 230,
  "max_load_watts": null,
  "max_load_amps": 4,
  "sensor_temperature": false,
  "sensor_humidity": false,
  "sensor_vpd": false,
  "sensor_co2": false,
  "sensor_light": false,
  "sensor_soil_moisture": false,
  "sensor_water_temp": false,
  "sensor_ph": false,
  "sensor_ec": false,
  "sensor_level": false,
  "sensor_pressure": false,
  "control_temperature": false,
  "control_humidity": false,
  "control_vpd": false,
  "control_fan_speed": false,
  "control_light_schedule": false,
  "control_light_dimming": false,
  "control_ir_uv": false,
  "control_co2": false,
  "control_irrigation": true,
  "control_ph": false,
  "control_ec": false,
  "control_heater": false,
  "control_dehumidifier": false,
  "control_humidifier": false,
  "control_pump": true,
  "app_control": false,
  "wifi": false,
  "bluetooth": false,
  "cloud_required": false,
  "local_control": true,
  "api_available": false,
  "mqtt_available": false,
  "automation_rules": false,
  "data_logging": false,
  "alerts": false,
  "display_included": false,
  "touchscreen": false,
  "firmware_updates": false,
  "ai_features": false,
  "ai_feature_type": "none",
  "ai_grow_assistant": false,
  "ai_climate_optimization": false,
  "ai_vpd_optimization": false,
  "ai_light_schedule_optimization": false,
  "ai_irrigation_optimization": false,
  "ai_nutrient_recommendations": false,
  "ai_anomaly_detection": false,
  "ai_alert_summarization": false,
  "ai_camera_analysis": false,
  "ai_plant_stage_detection": false,
  "ai_pest_detection": false,
  "ai_disease_detection": false,
  "ai_yield_prediction": false,
  "ai_training_recommendations": false,
  "ai_voice_assistant": false,
  "ai_requires_cloud": false,
  "ai_requires_subscription": false,
  "ai_data_export": false,
  "ai_notes": null,
  "compatible_ec_fans": null,
  "compatible_lights": null,
  "compatible_sensors": null,
  "compatible_humidifiers": null,
  "compatible_irrigation": "drip irrigation pumps, hydroponic pumps",
  "compatible_co2_equipment": null,
  "compatible_brand_ecosystem": "any",
  "supported_manufacturer_series": null,
  "power_supply_included": true,
  "mounting_type": "desktop",
  "length_mm": null,
  "width_mm": null,
  "height_mm": null,
  "weight_kg": 0.9,
  "recommended_tent_min_cm": null,
  "recommended_tent_max_cm": null,
  "recommended_use_note": "Pre-programmed drip irrigation timer for hydroponic and soil grow systems. User selects light cycle (12/12 or 18/6) and sets drip duration in seconds; timer automatically manages feeding frequency throughout the day (more feeds at start, fewer toward end of light period).",
  "include_in_default_controller_calculator": true,
  "source_url": "https://www.2s-international.com/shop/smscom/smscom-nutrimatic-mk2/",
  "source_type": "manufacturer",
  "source_date": "2026-06-28",
  "confidence_level": "B",
  "uvp_amount": 164,
  "uvp_currency": "EUR",
  "uvp_source_url": "https://www.2s-international.com/shop/smscom/smscom-nutrimatic-mk2/",
  "uvp_source_type": "manufacturer",
  "uvp_source_date": "2026-06-28",
  "uvp_confidence_level": "B",
  "uvp_notes": "Retail prices: €179.90 (growmart.eu). 2S International manufacturer/distributor price used as UVP.",
  "notes": "Pure pre-programmed timer — no sensor inputs, no user-programmable rule logic. Fixed schedule: 19 drip cycles per day for 18/6 cycle, 20 cycles for 12/12 cycle. Only user adjustment is drip duration (0–99 seconds) and light-cycle mode selection. Max load listed as 4A (max ~920W at 230V); some retailer listings state 2000W which is inconsistent and likely incorrect for the EU version. Amazon.de search found possible listing ASIN B00BM50BZ6 but Mk2 designation not confirmed — not included. Available in EU, UK, AUS versions. 5-year warranty."
}