{
  "brand": "Bluelab",
  "series": "IntelliClimate",
  "model": "IntelliClimate",
  "revision": null,
  "status": "active",
  "controller_type": "climate_controller",
  "controller_role": "primary",
  "system_category": "standalone",
  "supported_devices": "fans, air conditioners, heaters, dehumidifiers, humidifiers, foggers, CO2 injection/extraction equipment, 2 banks of lights; controlled via 24 VDC relay boxes",
  "max_device_count": 9,
  "max_ports": 9,
  "port_types": "9x 24 VDC outputs, USB-B, EnviroSensor cable connection, reed switch alarm input",
  "plug_type": "universal",
  "output_voltage_v": 24,
  "max_load_watts": null,
  "max_load_amps": 3,
  "sensor_temperature": true,
  "sensor_humidity": true,
  "sensor_vpd": false,
  "sensor_co2": true,
  "sensor_light": true,
  "sensor_soil_moisture": false,
  "sensor_water_temp": false,
  "sensor_ph": false,
  "sensor_ec": false,
  "sensor_level": false,
  "sensor_pressure": false,
  "control_temperature": true,
  "control_humidity": true,
  "control_vpd": false,
  "control_fan_speed": "partial",
  "control_light_schedule": true,
  "control_light_dimming": false,
  "control_ir_uv": false,
  "control_co2": true,
  "control_irrigation": false,
  "control_ph": false,
  "control_ec": false,
  "control_heater": true,
  "control_dehumidifier": true,
  "control_humidifier": true,
  "control_pump": false,
  "app_control": true,
  "wifi": "partial",
  "bluetooth": false,
  "cloud_required": false,
  "local_control": true,
  "api_available": "unknown",
  "mqtt_available": "unknown",
  "automation_rules": true,
  "data_logging": true,
  "alerts": true,
  "display_included": true,
  "touchscreen": false,
  "firmware_updates": "unknown",
  "ai_features": false,
  "ai_feature_type": "none",
  "ai_grow_assistant": false,
  "ai_climate_optimization": false,
  "ai_vpd_optimization": false,
  "ai_light_schedule_optimization": false,
  "ai_irrigation_optimization": false,
  "ai_nutrient_recommendations": false,
  "ai_anomaly_detection": false,
  "ai_alert_summarization": false,
  "ai_camera_analysis": false,
  "ai_plant_stage_detection": false,
  "ai_pest_detection": false,
  "ai_disease_detection": false,
  "ai_yield_prediction": false,
  "ai_training_recommendations": false,
  "ai_voice_assistant": false,
  "ai_requires_cloud": false,
  "ai_requires_subscription": false,
  "ai_data_export": true,
  "ai_notes": null,
  "compatible_ec_fans": "any mains-powered fan via 24 VDC relay box",
  "compatible_lights": "any mains-powered light bank via 24 VDC relay box",
  "compatible_sensors": "Bluelab EnviroSensor (temperature, humidity, CO2, light); optional: outside temperature sensor, lamp over-temperature sensor, intruder detection reed switch",
  "compatible_humidifiers": "any mains-powered humidifier or fogger via 24 VDC relay box",
  "compatible_irrigation": null,
  "compatible_co2_equipment": "any CO2 injection or extraction system via 24 VDC relay box",
  "compatible_brand_ecosystem": "Bluelab IntelliGrow",
  "supported_manufacturer_series": "Bluelab EnviroSensor",
  "power_supply_included": true,
  "mounting_type": "wall_mount",
  "length_mm": null,
  "width_mm": null,
  "height_mm": null,
  "weight_kg": null,
  "recommended_tent_min_cm": null,
  "recommended_tent_max_cm": null,
  "recommended_use_note": "Commercial grow room climate management; controls temperature, humidity, CO2, and 2 light banks via 9 relay-driven output channels; effective for rooms up to 10×10 m; add second EnviroSensor for larger areas",
  "include_in_default_controller_calculator": true,
  "source_url": "https://support.bluelab.com/intelliclimate",
  "source_type": "manufacturer",
  "source_date": "2026-06-28",
  "confidence_level": "B",
  "uvp_amount": 2200,
  "uvp_currency": "USD",
  "uvp_source_url": "https://greenthumbdepot.com/products/autogrow-intelliclimate-kit",
  "uvp_source_type": "retailer",
  "uvp_source_date": "2026-06-28",
  "uvp_confidence_level": "C",
  "uvp_notes": "US retailer Green Thumb Depot lists complete kit at $2,200 USD; Canadian retailer Evergreen Botany lists at CAD $4,508. No EUR price found. Not listed on EU Bluelab store.",
  "notes": "Formerly Autogrow IntelliClimate; acquired by Bluelab portfolio via Excel Seeds acquisition. Wi-Fi requires optional Bluelab IntelliLink (USB accessory, sold separately; 2.4 GHz only). The 9 outputs are 24 VDC at 3 A per port (total limited by 24 V 2.5 A power supply); outputs drive relay boxes that switch mains-voltage equipment. Features Autolearn CO2 cycle optimisation, Autoset stage-based scheduling, and advanced rules engine. Supports dual EnviroSensor for areas larger than 10×10 m. USB to PC for data logging via IntelliGrow software. Fan control is on/off only via relay, not variable speed. Temp accuracy ±0.5°C, RH accuracy ±2%, CO2 accuracy ±50 ppm."
}