{
  "brand": "Autopilot",
  "series": null,
  "model": "High Power HID Controller 8-Light 8000W",
  "revision": "APCL8DX",
  "status": "active",
  "controller_type": "light_controller",
  "controller_role": "primary",
  "system_category": "standalone",
  "supported_devices": "HID grow lights (ballasts)",
  "max_device_count": 8,
  "max_ports": 8,
  "port_types": "8x X-style 120/240V outlets, 1x 120V trigger cable input",
  "plug_type": "US",
  "output_voltage_v": null,
  "max_load_watts": 8000,
  "max_load_amps": 60,
  "sensor_temperature": false,
  "sensor_humidity": false,
  "sensor_vpd": false,
  "sensor_co2": false,
  "sensor_light": false,
  "sensor_soil_moisture": false,
  "sensor_water_temp": false,
  "sensor_ph": false,
  "sensor_ec": false,
  "sensor_level": false,
  "sensor_pressure": false,
  "control_temperature": false,
  "control_humidity": false,
  "control_vpd": false,
  "control_fan_speed": false,
  "control_light_schedule": false,
  "control_light_dimming": false,
  "control_ir_uv": false,
  "control_co2": false,
  "control_irrigation": false,
  "control_ph": false,
  "control_ec": false,
  "control_heater": false,
  "control_dehumidifier": false,
  "control_humidifier": false,
  "control_pump": false,
  "app_control": false,
  "wifi": false,
  "bluetooth": false,
  "cloud_required": false,
  "local_control": true,
  "api_available": false,
  "mqtt_available": false,
  "automation_rules": false,
  "data_logging": false,
  "alerts": false,
  "display_included": false,
  "touchscreen": false,
  "firmware_updates": false,
  "ai_features": false,
  "ai_feature_type": "none",
  "ai_grow_assistant": false,
  "ai_climate_optimization": false,
  "ai_vpd_optimization": false,
  "ai_light_schedule_optimization": false,
  "ai_irrigation_optimization": false,
  "ai_nutrient_recommendations": false,
  "ai_anomaly_detection": false,
  "ai_alert_summarization": false,
  "ai_camera_analysis": false,
  "ai_plant_stage_detection": false,
  "ai_pest_detection": false,
  "ai_disease_detection": false,
  "ai_yield_prediction": false,
  "ai_training_recommendations": false,
  "ai_voice_assistant": false,
  "ai_requires_cloud": false,
  "ai_requires_subscription": false,
  "ai_data_export": false,
  "ai_notes": null,
  "compatible_ec_fans": null,
  "compatible_lights": "HID grow lights (ballasts)",
  "compatible_sensors": null,
  "compatible_humidifiers": null,
  "compatible_irrigation": null,
  "compatible_co2_equipment": null,
  "compatible_brand_ecosystem": "any",
  "supported_manufacturer_series": null,
  "power_supply_included": false,
  "mounting_type": "wall_mount",
  "length_mm": 254,
  "width_mm": 203,
  "height_mm": 114,
  "weight_kg": 1,
  "recommended_tent_min_cm": null,
  "recommended_tent_max_cm": null,
  "recommended_use_note": "For large-scale HID lighting setups; X-style outlets accept both 120V and 240V ballast cords without cable changes; requires external timer or master controller for scheduling",
  "include_in_default_controller_calculator": true,
  "source_url": "https://mattshydroponics.com/autopilot-8-light-high-power-hid-controller-8000w-120-240v-60a/",
  "source_type": "retailer",
  "source_date": "2026-06-28",
  "confidence_level": "B",
  "uvp_amount": 219.99,
  "uvp_currency": "USD",
  "uvp_source_url": "https://mattshydroponics.com/autopilot-8-light-high-power-hid-controller-8000w-120-240v-60a/",
  "uvp_source_type": "retailer",
  "uvp_source_date": "2026-06-28",
  "uvp_confidence_level": "C",
  "uvp_notes": "US retailer price; varies across retailers ($189.95–$219.99 USD)",
  "notes": "US-spec product (X-style 120/240V outlets); not sold in EU/Germany. Purely electromechanical relay controller; 2 relays of 30A each. Activated by detachable 120V trigger cable from external timer. 3-year warranty. Physical dimensions (8x10x4.5 in) and weight (2.2 lbs / 1.0 kg) sourced from Amazon listing; one retailer cited 6.5 lbs — treat weight with caution. Amazon US ASIN: B008NP8QWS."
}