{
  "brand": "Inkbird",
  "series": "ITC-306T Series",
  "model": "ITC-306T-WIFI",
  "revision": null,
  "status": "active",
  "controller_type": "climate_controller",
  "controller_role": "primary",
  "system_category": "app_ecosystem",
  "supported_devices": "Heaters, heating mats, heat lamps (heating only)",
  "max_device_count": 2,
  "max_ports": 2,
  "port_types": "EU Schuko outlet ×2 (both heating only), NTC temperature probe",
  "plug_type": "EU",
  "output_voltage_v": 230,
  "max_load_watts": null,
  "max_load_amps": 10,
  "sensor_temperature": true,
  "sensor_humidity": false,
  "sensor_vpd": false,
  "sensor_co2": false,
  "sensor_light": false,
  "sensor_soil_moisture": false,
  "sensor_water_temp": false,
  "sensor_ph": false,
  "sensor_ec": false,
  "sensor_level": false,
  "sensor_pressure": false,
  "control_temperature": true,
  "control_humidity": false,
  "control_vpd": false,
  "control_fan_speed": false,
  "control_light_schedule": false,
  "control_light_dimming": false,
  "control_ir_uv": false,
  "control_co2": false,
  "control_irrigation": false,
  "control_ph": false,
  "control_ec": false,
  "control_heater": true,
  "control_dehumidifier": false,
  "control_humidifier": false,
  "control_pump": false,
  "app_control": true,
  "wifi": true,
  "bluetooth": false,
  "cloud_required": "partial",
  "local_control": true,
  "api_available": false,
  "mqtt_available": false,
  "automation_rules": "partial",
  "data_logging": true,
  "alerts": true,
  "display_included": true,
  "touchscreen": false,
  "firmware_updates": true,
  "ai_features": false,
  "ai_feature_type": "none",
  "ai_grow_assistant": false,
  "ai_climate_optimization": false,
  "ai_vpd_optimization": false,
  "ai_light_schedule_optimization": false,
  "ai_irrigation_optimization": false,
  "ai_nutrient_recommendations": false,
  "ai_anomaly_detection": false,
  "ai_alert_summarization": false,
  "ai_camera_analysis": false,
  "ai_plant_stage_detection": false,
  "ai_pest_detection": false,
  "ai_disease_detection": false,
  "ai_yield_prediction": false,
  "ai_training_recommendations": false,
  "ai_voice_assistant": false,
  "ai_requires_cloud": false,
  "ai_requires_subscription": false,
  "ai_data_export": false,
  "ai_notes": null,
  "compatible_ec_fans": null,
  "compatible_lights": "any (on/off only)",
  "compatible_sensors": null,
  "compatible_humidifiers": null,
  "compatible_irrigation": null,
  "compatible_co2_equipment": null,
  "compatible_brand_ecosystem": "any",
  "supported_manufacturer_series": null,
  "power_supply_included": null,
  "mounting_type": "desktop",
  "length_mm": null,
  "width_mm": null,
  "height_mm": null,
  "weight_kg": null,
  "recommended_tent_min_cm": null,
  "recommended_tent_max_cm": null,
  "recommended_use_note": "WiFi-enabled heating-only controller with app-configurable day/night temperature timer. Both outlets are heating outputs. Day/night schedules and alarm thresholds adjustable remotely via Inkbird app. Operates as standalone thermostat without internet. 2.4GHz WiFi only.",
  "include_in_default_controller_calculator": true,
  "source_url": "https://eu.inkbird.com/products/wi-fi-temperature-controller-itc-306t-wifi",
  "source_type": "manufacturer",
  "source_date": "2026-06-28",
  "confidence_level": "A",
  "uvp_amount": 42.99,
  "uvp_currency": "EUR",
  "uvp_source_url": "https://eu.inkbird.com/products/wi-fi-temperature-controller-itc-306t-wifi",
  "uvp_source_type": "manufacturer",
  "uvp_source_date": "2026-06-28",
  "uvp_confidence_level": "A",
  "uvp_notes": null,
  "notes": "Heating ONLY — no cooling outlet. Both sockets heat simultaneously. Day/night cycle: two temperature setpoints (TS1 day, TS2 night) configurable via Inkbird app or directly on device. App: Inkbird (2.4GHz WiFi required). Temperature history logging and push alerts via app. Max load: 10A at 100-240V AC (EU max wattage not explicitly stated). Amazon.de ASIN B094FL4BVK identified from search (URL path confirmed WIFI variant); verify listing before use."
}