{
  "brand": "TechGrow",
  "series": "Ballast Eco",
  "model": "Ballast Eco 4x600",
  "revision": null,
  "status": "active",
  "controller_type": "light_controller",
  "controller_role": "primary",
  "system_category": "standalone",
  "supported_devices": "HID grow lights (HPS, MH) up to 600W each",
  "max_device_count": 4,
  "max_ports": 4,
  "port_types": "Schuko outlet (4x)",
  "plug_type": "EU",
  "output_voltage_v": null,
  "max_load_watts": 2400,
  "max_load_amps": null,
  "sensor_temperature": false,
  "sensor_humidity": false,
  "sensor_vpd": false,
  "sensor_co2": false,
  "sensor_light": false,
  "sensor_soil_moisture": false,
  "sensor_water_temp": false,
  "sensor_ph": false,
  "sensor_ec": false,
  "sensor_level": false,
  "sensor_pressure": false,
  "control_temperature": false,
  "control_humidity": false,
  "control_vpd": false,
  "control_fan_speed": false,
  "control_light_schedule": true,
  "control_light_dimming": false,
  "control_ir_uv": false,
  "control_co2": false,
  "control_irrigation": false,
  "control_ph": false,
  "control_ec": false,
  "control_heater": false,
  "control_dehumidifier": false,
  "control_humidifier": false,
  "control_pump": false,
  "app_control": false,
  "wifi": false,
  "bluetooth": false,
  "cloud_required": false,
  "local_control": true,
  "api_available": false,
  "mqtt_available": false,
  "automation_rules": false,
  "data_logging": false,
  "alerts": false,
  "display_included": false,
  "touchscreen": false,
  "firmware_updates": false,
  "ai_features": false,
  "ai_feature_type": "none",
  "ai_grow_assistant": false,
  "ai_climate_optimization": false,
  "ai_vpd_optimization": false,
  "ai_light_schedule_optimization": false,
  "ai_irrigation_optimization": false,
  "ai_nutrient_recommendations": false,
  "ai_anomaly_detection": false,
  "ai_alert_summarization": false,
  "ai_camera_analysis": false,
  "ai_plant_stage_detection": false,
  "ai_pest_detection": false,
  "ai_disease_detection": false,
  "ai_yield_prediction": false,
  "ai_training_recommendations": false,
  "ai_voice_assistant": false,
  "ai_requires_cloud": false,
  "ai_requires_subscription": false,
  "ai_data_export": false,
  "ai_notes": null,
  "compatible_ec_fans": null,
  "compatible_lights": "HID grow lights (HPS, MH) up to 600W",
  "compatible_sensors": null,
  "compatible_humidifiers": null,
  "compatible_irrigation": null,
  "compatible_co2_equipment": null,
  "compatible_brand_ecosystem": "any",
  "supported_manufacturer_series": null,
  "power_supply_included": true,
  "mounting_type": "unknown",
  "length_mm": null,
  "width_mm": null,
  "height_mm": null,
  "weight_kg": null,
  "recommended_tent_min_cm": null,
  "recommended_tent_max_cm": null,
  "recommended_use_note": "Simple mechanical timer relay for up to 4 x 600W HID grow lights; 15-minute interval scheduling with up to 48 switching moments per 24-hour cycle; no digital features",
  "include_in_default_controller_calculator": true,
  "source_url": "https://techgrow.nl/ballast-eco-4x600.html",
  "source_type": "manufacturer",
  "source_date": "2026-06-28",
  "confidence_level": "C",
  "uvp_amount": 107.69,
  "uvp_currency": "EUR",
  "uvp_source_url": "https://techgrow.nl/ballast-eco-4x600.html",
  "uvp_source_type": "manufacturer",
  "uvp_source_date": "2026-06-28",
  "uvp_confidence_level": "B",
  "uvp_notes": "Original price €107.69 listed on manufacturer website; current sale/promotional price €89.00; SKU 1718X",
  "notes": "Mechanical rotary timer (not digital); 4 Schuko outlets each rated 600W; 3 operating modes: Clock (24h repeat cycle), On (continuous), Off; plug type configurable at purchase (EU/UK/other); also available as 2x600W variant (Ballast Eco 2x600). No electrical spec sheet publicly accessible for 4x600 variant; max load inferred from 4x600W socket rating."
}