{
  "brand": "Autopilot",
  "series": "FUEL",
  "model": "FUEL ST12",
  "revision": "APT0122",
  "status": "active",
  "controller_type": "light_controller",
  "controller_role": "primary",
  "system_category": "standalone",
  "supported_devices": "HID grow lights (ballasts)",
  "max_device_count": 12,
  "max_ports": 12,
  "port_types": "12x NEMA 6-15 240V outlets, 1x 120V trigger cable input",
  "plug_type": "US",
  "output_voltage_v": 240,
  "max_load_watts": 14400,
  "max_load_amps": 60,
  "sensor_temperature": false,
  "sensor_humidity": false,
  "sensor_vpd": false,
  "sensor_co2": false,
  "sensor_light": false,
  "sensor_soil_moisture": false,
  "sensor_water_temp": false,
  "sensor_ph": false,
  "sensor_ec": false,
  "sensor_level": false,
  "sensor_pressure": false,
  "control_temperature": false,
  "control_humidity": false,
  "control_vpd": false,
  "control_fan_speed": false,
  "control_light_schedule": false,
  "control_light_dimming": false,
  "control_ir_uv": false,
  "control_co2": false,
  "control_irrigation": false,
  "control_ph": false,
  "control_ec": false,
  "control_heater": false,
  "control_dehumidifier": false,
  "control_humidifier": false,
  "control_pump": false,
  "app_control": false,
  "wifi": false,
  "bluetooth": false,
  "cloud_required": false,
  "local_control": true,
  "api_available": false,
  "mqtt_available": false,
  "automation_rules": false,
  "data_logging": false,
  "alerts": false,
  "display_included": false,
  "touchscreen": false,
  "firmware_updates": false,
  "ai_features": false,
  "ai_feature_type": "none",
  "ai_grow_assistant": false,
  "ai_climate_optimization": false,
  "ai_vpd_optimization": false,
  "ai_light_schedule_optimization": false,
  "ai_irrigation_optimization": false,
  "ai_nutrient_recommendations": false,
  "ai_anomaly_detection": false,
  "ai_alert_summarization": false,
  "ai_camera_analysis": false,
  "ai_plant_stage_detection": false,
  "ai_pest_detection": false,
  "ai_disease_detection": false,
  "ai_yield_prediction": false,
  "ai_training_recommendations": false,
  "ai_voice_assistant": false,
  "ai_requires_cloud": false,
  "ai_requires_subscription": false,
  "ai_data_export": false,
  "ai_notes": null,
  "compatible_ec_fans": null,
  "compatible_lights": "HID grow lights (ballasts)",
  "compatible_sensors": null,
  "compatible_humidifiers": null,
  "compatible_irrigation": null,
  "compatible_co2_equipment": null,
  "compatible_brand_ecosystem": "any",
  "supported_manufacturer_series": null,
  "power_supply_included": false,
  "mounting_type": "wall_mount",
  "length_mm": null,
  "width_mm": null,
  "height_mm": null,
  "weight_kg": 17.46,
  "recommended_tent_min_cm": null,
  "recommended_tent_max_cm": null,
  "recommended_use_note": "For commercial 240V HID grows with up to 12 lights; 3 banks of 4 with 30-second staggered startup delay per bank; requires external timer or master controller; professional electrical installation required (80A service)",
  "include_in_default_controller_calculator": true,
  "source_url": "https://www.growgeneration.com/fuel-st12-light-controller-12-outlet-240v-with-single-trigger.html",
  "source_type": "retailer",
  "source_date": "2026-06-28",
  "confidence_level": "B",
  "uvp_amount": 599.99,
  "uvp_currency": "USD",
  "uvp_source_url": "https://www.growitdepot.com/products/autopilot-fuel-light-controllers",
  "uvp_source_type": "retailer",
  "uvp_source_date": "2026-06-28",
  "uvp_confidence_level": "C",
  "uvp_notes": "US retailer price; other sources list SRP at $749.99–$878.89 USD",
  "notes": "US-spec product (NEMA 6-15 240V outlets, 60Hz); not sold in EU/Germany. ETL-listed, commercial grade. 3 banks of 4 outlets with 30-second staggered startup delay; each bank protected by industrial-grade circuit breaker. Requires 80A main power supply; max ballast load 60A. Single 120V trigger cable controls all 12 outlets. max_load_watts calculated from 60A x 240V. 2-year warranty. Physical dimensions not found. No confirmed Amazon listing found for APT0122."
}