{
  "brand": "AC Infinity",
  "series": "Controller 75",
  "model": "Controller 75",
  "revision": null,
  "status": "active",
  "controller_type": "climate_controller",
  "controller_role": "primary",
  "system_category": "app_ecosystem",
  "supported_devices": "Any standard AC outlet device: inline duct fans, exhaust fans, oscillating fans, heat mats, humidifiers, dehumidifiers, heaters",
  "max_device_count": 2,
  "max_ports": 2,
  "port_types": "AC outlet (x2), 3.5mm probe",
  "plug_type": "EU",
  "output_voltage_v": null,
  "max_load_watts": 1100,
  "max_load_amps": 10,
  "sensor_temperature": true,
  "sensor_humidity": true,
  "sensor_vpd": "calculated",
  "sensor_co2": false,
  "sensor_light": false,
  "sensor_soil_moisture": false,
  "sensor_water_temp": false,
  "sensor_ph": false,
  "sensor_ec": false,
  "sensor_level": false,
  "sensor_pressure": false,
  "control_temperature": true,
  "control_humidity": true,
  "control_vpd": true,
  "control_fan_speed": false,
  "control_light_schedule": true,
  "control_light_dimming": false,
  "control_ir_uv": false,
  "control_co2": false,
  "control_irrigation": false,
  "control_ph": false,
  "control_ec": false,
  "control_heater": true,
  "control_dehumidifier": true,
  "control_humidifier": true,
  "control_pump": false,
  "app_control": true,
  "wifi": true,
  "bluetooth": true,
  "cloud_required": false,
  "local_control": true,
  "api_available": false,
  "mqtt_available": false,
  "automation_rules": true,
  "data_logging": true,
  "alerts": true,
  "display_included": true,
  "touchscreen": false,
  "firmware_updates": true,
  "ai_features": false,
  "ai_feature_type": "none",
  "ai_grow_assistant": false,
  "ai_climate_optimization": false,
  "ai_vpd_optimization": false,
  "ai_light_schedule_optimization": false,
  "ai_irrigation_optimization": false,
  "ai_nutrient_recommendations": false,
  "ai_anomaly_detection": false,
  "ai_alert_summarization": false,
  "ai_camera_analysis": false,
  "ai_plant_stage_detection": false,
  "ai_pest_detection": false,
  "ai_disease_detection": false,
  "ai_yield_prediction": false,
  "ai_training_recommendations": false,
  "ai_voice_assistant": false,
  "ai_requires_cloud": false,
  "ai_requires_subscription": false,
  "ai_data_export": false,
  "ai_notes": null,
  "compatible_ec_fans": "any",
  "compatible_lights": "any",
  "compatible_sensors": "AC Infinity 3.5mm temperature & humidity probe (included)",
  "compatible_humidifiers": "any",
  "compatible_irrigation": null,
  "compatible_co2_equipment": null,
  "compatible_brand_ecosystem": "any",
  "supported_manufacturer_series": null,
  "power_supply_included": false,
  "mounting_type": "desktop",
  "length_mm": 123,
  "width_mm": 118,
  "height_mm": 30,
  "weight_kg": null,
  "recommended_tent_min_cm": null,
  "recommended_tent_max_cm": null,
  "recommended_use_note": "Desktop 2-outlet thermostat for standard AC devices; on/off control triggered by temperature, humidity, or VPD; suitable for heat mats, non-variable-speed fans, humidifiers, dehumidifiers",
  "include_in_default_controller_calculator": true,
  "source_url": "https://acinfinity.com/controller-75-climate-controller-2-outlet-desktop-with-temp-humidity-vpd-sensor/",
  "source_type": "manufacturer",
  "source_date": "2026-06-28",
  "confidence_level": "B",
  "uvp_amount": 70.22,
  "uvp_currency": "EUR",
  "uvp_source_url": "https://acinfinity.com/controllers/",
  "uvp_source_type": "manufacturer",
  "uvp_source_date": "2026-06-28",
  "uvp_confidence_level": "A",
  "uvp_notes": null,
  "notes": "Current generation is CTR75P (WiFi + Bluetooth). An older Bluetooth-only base model also exists. Amazon.de ASIN B0BLRD7XKW is confirmed on the German marketplace but may correspond to the older BT-only variant; PRO version (B0DBRPBGHT, WiFi+BT) confirmed on Amazon.com only. Outlets are on/off only — no variable speed control. Power cord 53 in (4.4 ft). Backup memory retains settings when unpowered."
}