{
  "brand": "Autopilot",
  "series": "ECLIPSE",
  "model": "APE4200",
  "revision": "F90",
  "status": "unknown",
  "controller_type": "multi_function_controller",
  "controller_role": "primary",
  "system_category": "standalone",
  "supported_devices": "fans, CO2 injectors, CO2 generators, air conditioners, dehumidifiers, humidifiers",
  "max_device_count": 4,
  "max_ports": 4,
  "port_types": "4x NEMA 5-15 outlet (cooling, heating, humidify/dehumidify, CO2 ppm), 15-ft remote probe connector",
  "plug_type": "US",
  "output_voltage_v": 120,
  "max_load_watts": 1740,
  "max_load_amps": 14.5,
  "sensor_temperature": true,
  "sensor_humidity": true,
  "sensor_vpd": false,
  "sensor_co2": true,
  "sensor_light": true,
  "sensor_soil_moisture": false,
  "sensor_water_temp": false,
  "sensor_ph": false,
  "sensor_ec": false,
  "sensor_level": false,
  "sensor_pressure": false,
  "control_temperature": true,
  "control_humidity": true,
  "control_vpd": false,
  "control_fan_speed": false,
  "control_light_schedule": false,
  "control_light_dimming": false,
  "control_ir_uv": false,
  "control_co2": true,
  "control_irrigation": false,
  "control_ph": false,
  "control_ec": false,
  "control_heater": true,
  "control_dehumidifier": true,
  "control_humidifier": true,
  "control_pump": false,
  "app_control": false,
  "wifi": false,
  "bluetooth": false,
  "cloud_required": false,
  "local_control": true,
  "api_available": false,
  "mqtt_available": false,
  "automation_rules": "partial",
  "data_logging": true,
  "alerts": true,
  "display_included": true,
  "touchscreen": false,
  "firmware_updates": false,
  "ai_features": false,
  "ai_feature_type": "none",
  "ai_grow_assistant": false,
  "ai_climate_optimization": false,
  "ai_vpd_optimization": false,
  "ai_light_schedule_optimization": false,
  "ai_irrigation_optimization": false,
  "ai_nutrient_recommendations": false,
  "ai_anomaly_detection": false,
  "ai_alert_summarization": false,
  "ai_camera_analysis": false,
  "ai_plant_stage_detection": false,
  "ai_pest_detection": false,
  "ai_disease_detection": false,
  "ai_yield_prediction": false,
  "ai_training_recommendations": false,
  "ai_voice_assistant": false,
  "ai_requires_cloud": false,
  "ai_requires_subscription": false,
  "ai_data_export": false,
  "ai_notes": null,
  "compatible_ec_fans": "any 120V",
  "compatible_lights": null,
  "compatible_sensors": "included 15-ft remote probe (temp/humidity/dual-beam CO2/photocell)",
  "compatible_humidifiers": "any 120V",
  "compatible_irrigation": null,
  "compatible_co2_equipment": "CO2 generators (LP/NG), CO2 tanks with solenoid valves",
  "compatible_brand_ecosystem": "any",
  "supported_manufacturer_series": null,
  "power_supply_included": false,
  "mounting_type": "wall_mount",
  "length_mm": null,
  "width_mm": null,
  "height_mm": null,
  "weight_kg": null,
  "recommended_tent_min_cm": null,
  "recommended_tent_max_cm": null,
  "recommended_use_note": "Full grow room environmental control for temperature, humidity, and CO2 ppm from one unit. US voltage (120V/60Hz) only — requires transformer for Germany.",
  "include_in_default_controller_calculator": true,
  "source_url": "https://www.hydrofarm.com/p/autopilot-eclipse-f90-master-environmental-controller/ape4200",
  "source_type": "manufacturer",
  "source_date": "2026-06-28",
  "confidence_level": "B",
  "uvp_amount": 253.77,
  "uvp_currency": "USD",
  "uvp_source_url": "https://growershouse.com/autopilot-eclipse-f90-master-environmental-controller",
  "uvp_source_type": "retailer",
  "uvp_source_date": "2026-06-28",
  "uvp_confidence_level": "D",
  "uvp_notes": "US retail price from Growers House (shown as sold out). Prices vary widely across retailers ($97–$835 observed). No EUR pricing found. Hydrofarm may no longer stock this model.",
  "notes": "Digital environmental controller with integrated CO2 sensing (US 120V/60Hz, NEMA 5-15). Remote probe includes dual-beam CO2 sensor, temp/humidity sensor, and photocell. Three digital screens: temp, humidity, CO2 ppm. Separate day/night setpoints for temp and humidity. CO2 control supports Fuzzy Logic mode (compressed tanks) and Standard mode (LP/NG generators). Optional high-temp emergency CO2 shutdown (shuts CO2 generator if temp rises 10°F above threshold). Internal battery backup preserves settings during power loss. Built-in data logger (min/max temp, humidity, CO2). Wall- or tent-mountable (two mounting kits included). Compatible with optional power expanders APCL4X/APCL8X. Status uncertain — sold out at major retailers as of 2026; Hydrofarm may have discontinued. Amazon.com ASIN: B07MGJB8G8."
}