{
  "brand": "Gavita",
  "series": "Master Controllers",
  "model": "EL2",
  "revision": null,
  "status": "discontinued",
  "controller_type": "light_controller",
  "controller_role": "primary",
  "system_category": "standalone",
  "supported_devices": "Gavita e-Series HID ballasts and fixtures (400/600/750/1000W), up to 80 across 2 channels (40 per channel); auxiliary equipment switching via ECM modules",
  "max_device_count": 80,
  "max_ports": 2,
  "port_types": "RJ9 (4P4C) main port, RJ9 (4P4C) aux port, 3.5mm probe jack (T1), 3.5mm probe jack (T2), cage clamp ECM1, cage clamp ECM2, cage clamp alarm NO, cage clamp alarm NC, 5V DC power input",
  "plug_type": "EU",
  "output_voltage_v": null,
  "max_load_watts": null,
  "max_load_amps": null,
  "sensor_temperature": true,
  "sensor_humidity": false,
  "sensor_vpd": false,
  "sensor_co2": false,
  "sensor_light": false,
  "sensor_soil_moisture": false,
  "sensor_water_temp": false,
  "sensor_ph": false,
  "sensor_ec": false,
  "sensor_level": false,
  "sensor_pressure": false,
  "control_temperature": "partial",
  "control_humidity": false,
  "control_vpd": false,
  "control_fan_speed": false,
  "control_light_schedule": true,
  "control_light_dimming": true,
  "control_ir_uv": false,
  "control_co2": false,
  "control_irrigation": false,
  "control_ph": false,
  "control_ec": false,
  "control_heater": false,
  "control_dehumidifier": false,
  "control_humidifier": false,
  "control_pump": false,
  "app_control": false,
  "wifi": false,
  "bluetooth": false,
  "cloud_required": false,
  "local_control": true,
  "api_available": false,
  "mqtt_available": false,
  "automation_rules": true,
  "data_logging": false,
  "alerts": true,
  "display_included": true,
  "touchscreen": false,
  "firmware_updates": "unknown",
  "ai_features": false,
  "ai_feature_type": "none",
  "ai_grow_assistant": false,
  "ai_climate_optimization": false,
  "ai_vpd_optimization": false,
  "ai_light_schedule_optimization": false,
  "ai_irrigation_optimization": false,
  "ai_nutrient_recommendations": false,
  "ai_anomaly_detection": false,
  "ai_alert_summarization": false,
  "ai_camera_analysis": false,
  "ai_plant_stage_detection": false,
  "ai_pest_detection": false,
  "ai_disease_detection": false,
  "ai_yield_prediction": false,
  "ai_training_recommendations": false,
  "ai_voice_assistant": false,
  "ai_requires_cloud": false,
  "ai_requires_subscription": false,
  "ai_data_export": false,
  "ai_notes": null,
  "compatible_ec_fans": null,
  "compatible_lights": "Gavita e-Series HID ballasts (400/600/750/1000W)",
  "compatible_sensors": "Gavita temperature sensor (3.5mm jack, 5m cable); 2 sensors supported",
  "compatible_humidifiers": "Any 120/240V equipment via ECM module relay switching (indirect, not closed-loop control)",
  "compatible_irrigation": null,
  "compatible_co2_equipment": "Any CO2 equipment via ECM module relay switching (indirect, not closed-loop control)",
  "compatible_brand_ecosystem": "Gavita",
  "supported_manufacturer_series": "e-Series",
  "power_supply_included": true,
  "mounting_type": "wall_mount",
  "length_mm": 127,
  "width_mm": 22,
  "height_mm": 75,
  "weight_kg": 0.17,
  "recommended_tent_min_cm": null,
  "recommended_tent_max_cm": null,
  "recommended_use_note": "Dual grow room 12/12 alternating (Inverse mode) or large single room (Follow mode) with up to 80 Gavita e-series ballasts; alarm contacts for external alarm system; original Gen 1, discontinued",
  "include_in_default_controller_calculator": false,
  "source_url": "https://www.coralsands.de/mediafiles/Sonstiges/Downloaddateien/gavita/EL2_Manual.pdf",
  "source_type": "manufacturer_pdf",
  "source_date": "2026-06-28",
  "confidence_level": "B",
  "uvp_amount": 395,
  "uvp_currency": "EUR",
  "uvp_source_url": "https://world-of-grow.de/Gavita-Mastercontroller-EL2-EU",
  "uvp_source_type": "retailer",
  "uvp_source_date": "2026-06-28",
  "uvp_confidence_level": "D",
  "uvp_notes": "Discontinued product; single retailer listing at 395€, may reflect old stock; GTIN 8718403051742",
  "notes": "Original Gen 1 model (product code 60.56.00.xx.xx); uses 100–240V AC to 5V DC adapter (Gen 2 uses 15V DC); dual channel; Follow mode (single room) and Inverse mode (dual room 12/12 alternating); 16x2 green OLED display; light dimming range 50–115%; ECM ports for auxiliary equipment switching (lights-on and lights-off controlled separately); alarm contacts NO/NC for external alarm integration; discontinued, replaced by Master Controller EL2 Gen 2"
}