{
  "brand": "Autopilot",
  "series": null,
  "model": "APCETHD",
  "revision": null,
  "status": "active",
  "controller_type": "multi_function_controller",
  "controller_role": "primary",
  "system_category": "standalone",
  "supported_devices": "fans, CO2 injectors, air conditioners, dehumidifiers, humidifiers",
  "max_device_count": 4,
  "max_ports": 4,
  "port_types": "4x NEMA 5-15 outlet (cooling, heating, humidify/dehumidify, CO2), 15-ft remote probe connector",
  "plug_type": "US",
  "output_voltage_v": 120,
  "max_load_watts": 1740,
  "max_load_amps": 14.5,
  "sensor_temperature": true,
  "sensor_humidity": true,
  "sensor_vpd": false,
  "sensor_co2": false,
  "sensor_light": true,
  "sensor_soil_moisture": false,
  "sensor_water_temp": false,
  "sensor_ph": false,
  "sensor_ec": false,
  "sensor_level": false,
  "sensor_pressure": false,
  "control_temperature": true,
  "control_humidity": true,
  "control_vpd": false,
  "control_fan_speed": false,
  "control_light_schedule": false,
  "control_light_dimming": false,
  "control_ir_uv": false,
  "control_co2": true,
  "control_irrigation": false,
  "control_ph": false,
  "control_ec": false,
  "control_heater": true,
  "control_dehumidifier": true,
  "control_humidifier": true,
  "control_pump": false,
  "app_control": false,
  "wifi": false,
  "bluetooth": false,
  "cloud_required": false,
  "local_control": true,
  "api_available": false,
  "mqtt_available": false,
  "automation_rules": "partial",
  "data_logging": true,
  "alerts": true,
  "display_included": true,
  "touchscreen": false,
  "firmware_updates": false,
  "ai_features": false,
  "ai_feature_type": "none",
  "ai_grow_assistant": false,
  "ai_climate_optimization": false,
  "ai_vpd_optimization": false,
  "ai_light_schedule_optimization": false,
  "ai_irrigation_optimization": false,
  "ai_nutrient_recommendations": false,
  "ai_anomaly_detection": false,
  "ai_alert_summarization": false,
  "ai_camera_analysis": false,
  "ai_plant_stage_detection": false,
  "ai_pest_detection": false,
  "ai_disease_detection": false,
  "ai_yield_prediction": false,
  "ai_training_recommendations": false,
  "ai_voice_assistant": false,
  "ai_requires_cloud": false,
  "ai_requires_subscription": false,
  "ai_data_export": false,
  "ai_notes": null,
  "compatible_ec_fans": "any 120V",
  "compatible_lights": null,
  "compatible_sensors": "included 15-ft remote probe (temp/humidity/photocell)",
  "compatible_humidifiers": "any 120V",
  "compatible_irrigation": null,
  "compatible_co2_equipment": "CO2 injectors, CO2 generators",
  "compatible_brand_ecosystem": "any",
  "supported_manufacturer_series": null,
  "power_supply_included": false,
  "mounting_type": "wall_mount",
  "length_mm": 178,
  "width_mm": 102,
  "height_mm": 229,
  "weight_kg": null,
  "recommended_tent_min_cm": null,
  "recommended_tent_max_cm": null,
  "recommended_use_note": "Digital grow room environmental control for temperature, humidity, and CO2 injection scheduling. US voltage (120V/60Hz) only — requires transformer for Germany.",
  "include_in_default_controller_calculator": true,
  "source_url": "https://beacontron.com/store/product_info.php?products_id=103",
  "source_type": "retailer",
  "source_date": "2026-06-28",
  "confidence_level": "B",
  "uvp_amount": 229.95,
  "uvp_currency": "USD",
  "uvp_source_url": "https://beacontron.com/store/product_info.php?products_id=103",
  "uvp_source_type": "retailer",
  "uvp_source_date": "2026-06-28",
  "uvp_confidence_level": "C",
  "uvp_notes": "US retail price; no EUR pricing found. Product requires 120V — not plug-and-play in Germany.",
  "notes": "Digital environmental controller (US 120V/60Hz, NEMA 5-15). Does not measure CO2 PPM — controls CO2 injection equipment by setpoint (100 PPM increments), coordinated with temperature function and photocell (CO2 off when lights off). 15-ft probe measures temp, humidity, and photocell (no CO2 sensor). Large digital display with LED window. Separate day/night setpoints for temp and humidity. Built-in data logger (min/max temp and humidity). No probe extension cable available. Amazon.com ASIN: B008NNPYKM."
}