{
  "brand": "GSE",
  "series": null,
  "model": "Fan Controller AC-EC LCD",
  "revision": null,
  "status": "active",
  "controller_type": "climate_controller",
  "controller_role": "primary",
  "system_category": "standalone",
  "supported_devices": "AC fans, EC fans",
  "max_device_count": 2,
  "max_ports": 4,
  "port_types": "Schuko outlet (2x), RJ45 (2x)",
  "plug_type": "EU",
  "output_voltage_v": 230,
  "max_load_watts": 2000,
  "max_load_amps": 10,
  "sensor_temperature": true,
  "sensor_humidity": true,
  "sensor_vpd": false,
  "sensor_co2": false,
  "sensor_light": true,
  "sensor_soil_moisture": false,
  "sensor_water_temp": false,
  "sensor_ph": false,
  "sensor_ec": false,
  "sensor_level": false,
  "sensor_pressure": true,
  "control_temperature": true,
  "control_humidity": true,
  "control_vpd": false,
  "control_fan_speed": true,
  "control_light_schedule": false,
  "control_light_dimming": false,
  "control_ir_uv": false,
  "control_co2": false,
  "control_irrigation": false,
  "control_ph": false,
  "control_ec": false,
  "control_heater": false,
  "control_dehumidifier": false,
  "control_humidifier": false,
  "control_pump": false,
  "app_control": false,
  "wifi": false,
  "bluetooth": false,
  "cloud_required": false,
  "local_control": true,
  "api_available": false,
  "mqtt_available": false,
  "automation_rules": true,
  "data_logging": false,
  "alerts": false,
  "display_included": true,
  "touchscreen": false,
  "firmware_updates": false,
  "ai_features": false,
  "ai_feature_type": "none",
  "ai_grow_assistant": false,
  "ai_climate_optimization": false,
  "ai_vpd_optimization": false,
  "ai_light_schedule_optimization": false,
  "ai_irrigation_optimization": false,
  "ai_nutrient_recommendations": false,
  "ai_anomaly_detection": false,
  "ai_alert_summarization": false,
  "ai_camera_analysis": false,
  "ai_plant_stage_detection": false,
  "ai_pest_detection": false,
  "ai_disease_detection": false,
  "ai_yield_prediction": false,
  "ai_training_recommendations": false,
  "ai_voice_assistant": false,
  "ai_requires_cloud": false,
  "ai_requires_subscription": false,
  "ai_data_export": false,
  "ai_notes": null,
  "compatible_ec_fans": "any EC fan with 0-10V or PWM input via RJ45",
  "compatible_lights": null,
  "compatible_sensors": null,
  "compatible_humidifiers": null,
  "compatible_irrigation": null,
  "compatible_co2_equipment": null,
  "compatible_brand_ecosystem": "any",
  "supported_manufacturer_series": null,
  "power_supply_included": false,
  "mounting_type": null,
  "length_mm": 130,
  "width_mm": 70,
  "height_mm": 80,
  "weight_kg": 0.65,
  "recommended_tent_min_cm": null,
  "recommended_tent_max_cm": null,
  "recommended_use_note": "Advanced grow room controller for mixed AC+EC fan setups. LCD display with rotary push knob. 15 programmable day/night settings for temperature, humidity, speed, and negative pressure. Built-in light sensor for automatic day/night switching.",
  "include_in_default_controller_calculator": true,
  "source_url": "https://www.led-grower.eu/gse-digitalni-regulator-ac-a-ec-ventilatoru-2x5a/",
  "source_type": "retailer",
  "source_date": "2026-06-28",
  "confidence_level": "B",
  "uvp_amount": 215.96,
  "uvp_currency": "EUR",
  "uvp_source_url": "https://www.led-grower.eu/gse-digitalni-regulator-ac-a-ec-ventilatoru-2x5a/",
  "uvp_source_type": "retailer",
  "uvp_source_date": "2026-06-28",
  "uvp_confidence_level": "C",
  "uvp_notes": "FC13-210FR (2x5A) at led-grower.eu. German retailers (growshop-germany.de, greenlight-shop.de) list at €222-249. A 16A variant also exists (Amazon.de B08X3LSY2V).",
  "notes": "Model FC13-210FR, EAN 010000013108. Case: 130x80x70mm; controller unit: 160x110x90mm; weight 0.65kg. Sensor cable 4m. Graphic LCD display; rotary push knob navigation. 15 programmable settings: temperature/humidity/speed/pressure for day and night. Two internal overheat sensors. RJ45 supports 0-10V or PWM for EC fans; two Schuko outlets for AC fans via TRIAC. IP54. Amazon.de B08X3LSY2V listed as '16A variant' — may differ from standard 2x5A model."
}