{
  "brand": "TechGrow",
  "series": "Humi",
  "model": "Humi Heavy",
  "revision": null,
  "status": "active",
  "controller_type": "climate_controller",
  "controller_role": "primary",
  "system_category": "standalone",
  "supported_devices": "Humidifiers or dehumidifiers (single device, user-selectable mode, high-power up to 10A)",
  "max_device_count": 1,
  "max_ports": 1,
  "port_types": "RJ45/UTP sensor port, Schuko outlet",
  "plug_type": "EU",
  "output_voltage_v": 230,
  "max_load_watts": null,
  "max_load_amps": 10,
  "sensor_temperature": true,
  "sensor_humidity": true,
  "sensor_vpd": "calculated",
  "sensor_co2": false,
  "sensor_light": false,
  "sensor_soil_moisture": false,
  "sensor_water_temp": false,
  "sensor_ph": false,
  "sensor_ec": false,
  "sensor_level": false,
  "sensor_pressure": false,
  "control_temperature": false,
  "control_humidity": true,
  "control_vpd": false,
  "control_fan_speed": false,
  "control_light_schedule": false,
  "control_light_dimming": false,
  "control_ir_uv": false,
  "control_co2": false,
  "control_irrigation": false,
  "control_ph": false,
  "control_ec": false,
  "control_heater": false,
  "control_dehumidifier": true,
  "control_humidifier": true,
  "control_pump": false,
  "app_control": false,
  "wifi": false,
  "bluetooth": false,
  "cloud_required": false,
  "local_control": true,
  "api_available": false,
  "mqtt_available": false,
  "automation_rules": false,
  "data_logging": false,
  "alerts": false,
  "display_included": true,
  "touchscreen": false,
  "firmware_updates": "unknown",
  "ai_features": false,
  "ai_feature_type": "none",
  "ai_grow_assistant": false,
  "ai_climate_optimization": false,
  "ai_vpd_optimization": false,
  "ai_light_schedule_optimization": false,
  "ai_irrigation_optimization": false,
  "ai_nutrient_recommendations": false,
  "ai_anomaly_detection": false,
  "ai_alert_summarization": false,
  "ai_camera_analysis": false,
  "ai_plant_stage_detection": false,
  "ai_pest_detection": false,
  "ai_disease_detection": false,
  "ai_yield_prediction": false,
  "ai_training_recommendations": false,
  "ai_voice_assistant": false,
  "ai_requires_cloud": false,
  "ai_requires_subscription": false,
  "ai_data_export": false,
  "ai_notes": null,
  "compatible_ec_fans": null,
  "compatible_lights": null,
  "compatible_sensors": "TechGrow Temp/RH sensor, TechGrow S-4 CO2 sensor (temp/humidity readings only)",
  "compatible_humidifiers": "Any 230V humidifier or dehumidifier up to 10A",
  "compatible_irrigation": null,
  "compatible_co2_equipment": null,
  "compatible_brand_ecosystem": "any",
  "supported_manufacturer_series": null,
  "power_supply_included": true,
  "mounting_type": "wall_mount",
  "length_mm": 130,
  "width_mm": 70,
  "height_mm": 180,
  "weight_kg": 0.765,
  "recommended_tent_min_cm": null,
  "recommended_tent_max_cm": null,
  "recommended_use_note": "Heavy-duty single-relay humidity controller (10A) for powerful humidifiers or dehumidifiers. Larger 2x16 LCD vs Humi Twin's 2x8. No day/night scheduling. Sensor sold separately.",
  "include_in_default_controller_calculator": true,
  "source_url": "https://www.techgrow.nl/humi-heavy.html",
  "source_type": "manufacturer",
  "source_date": "2026-06-28",
  "confidence_level": "B",
  "uvp_amount": 135.5,
  "uvp_currency": "EUR",
  "uvp_source_url": "https://www.techgrow.nl/humi-heavy.html",
  "uvp_source_type": "manufacturer",
  "uvp_source_date": "2026-06-28",
  "uvp_confidence_level": "B",
  "uvp_notes": "Base price without sensor (techgrow.nl). Temp/RH sensor sold separately ~€35.",
  "notes": "Heavy-duty version of Humi Twin; relay and fuse both rated 10A — suitable for high-draw humidifiers or dehumidifiers that exceed the Humi Twin's 6A practical limit. Single relay; user selects humidifier or dehumidifier mode via rear toggle switch. Measures and displays both humidity and temperature. LCD 2×16 characters (larger than Humi Twin). No day/night scheduling. Sensor not included; 5m UTP cable included. TechGrow DL-1 datalogger compatible. Incompatible with S-2 sensors."
}