{
  "brand": "Gavita",
  "series": "Master Controller",
  "model": "Master Controller EL2F Gen 2",
  "revision": "Gen 2",
  "status": "active",
  "controller_type": "multi_function_controller",
  "controller_role": "primary",
  "system_category": "standalone",
  "supported_devices": "Gavita e-series lights (HPS/LED), 0-10V EC fans, CO2 equipment (via ECM), heaters (via ECM)",
  "max_device_count": 80,
  "max_ports": null,
  "port_types": "RJ9 4P4C (2x lighting bus control), 3.5mm jack (2x temperature probe), cage clamp (2x ECM output, 2x alarm contacts NO/NC), 0-10V terminal (2x EC fan output)",
  "plug_type": "EU",
  "output_voltage_v": null,
  "max_load_watts": null,
  "max_load_amps": null,
  "sensor_temperature": true,
  "sensor_humidity": false,
  "sensor_vpd": false,
  "sensor_co2": false,
  "sensor_light": false,
  "sensor_soil_moisture": false,
  "sensor_water_temp": false,
  "sensor_ph": false,
  "sensor_ec": false,
  "sensor_level": false,
  "sensor_pressure": false,
  "control_temperature": true,
  "control_humidity": false,
  "control_vpd": false,
  "control_fan_speed": true,
  "control_light_schedule": true,
  "control_light_dimming": true,
  "control_ir_uv": false,
  "control_co2": true,
  "control_irrigation": false,
  "control_ph": false,
  "control_ec": false,
  "control_heater": true,
  "control_dehumidifier": false,
  "control_humidifier": false,
  "control_pump": false,
  "app_control": false,
  "wifi": false,
  "bluetooth": false,
  "cloud_required": false,
  "local_control": true,
  "api_available": false,
  "mqtt_available": false,
  "automation_rules": true,
  "data_logging": true,
  "alerts": true,
  "display_included": true,
  "touchscreen": false,
  "firmware_updates": "unknown",
  "ai_features": false,
  "ai_feature_type": "none",
  "ai_grow_assistant": false,
  "ai_climate_optimization": false,
  "ai_vpd_optimization": false,
  "ai_light_schedule_optimization": false,
  "ai_irrigation_optimization": false,
  "ai_nutrient_recommendations": false,
  "ai_anomaly_detection": false,
  "ai_alert_summarization": false,
  "ai_camera_analysis": false,
  "ai_plant_stage_detection": false,
  "ai_pest_detection": false,
  "ai_disease_detection": false,
  "ai_yield_prediction": false,
  "ai_training_recommendations": false,
  "ai_voice_assistant": false,
  "ai_requires_cloud": false,
  "ai_requires_subscription": false,
  "ai_data_export": false,
  "ai_notes": null,
  "compatible_ec_fans": "any 0-10V EC fans, up to 8 fans (2 per fan output)",
  "compatible_lights": "Gavita e-series fixtures (single bus: up to 80 total; repeater bus: up to 1000 total)",
  "compatible_sensors": "2x temperature probes (3.5mm jack, sold separately)",
  "compatible_humidifiers": null,
  "compatible_irrigation": null,
  "compatible_co2_equipment": "via ECM modules (sold separately)",
  "compatible_brand_ecosystem": "Gavita",
  "supported_manufacturer_series": "e-series (Pro, Pro-line, DigiStar, Slimline LED)",
  "power_supply_included": true,
  "mounting_type": "wall_mount",
  "length_mm": 110,
  "width_mm": 21,
  "height_mm": 65,
  "weight_kg": 0.115,
  "recommended_tent_min_cm": null,
  "recommended_tent_max_cm": null,
  "recommended_use_note": "EU/UK-specific model; controls up to 2 independent grow rooms with Gavita e-series lights, EC fans via PID algorithm, and auxiliary equipment (CO2, heaters) via ECM modules",
  "include_in_default_controller_calculator": true,
  "source_url": "https://www.led-grower.eu/gavita-master-controller-el2f-gen-2/",
  "source_type": "retailer",
  "source_date": "2026-06-28",
  "confidence_level": "B",
  "uvp_amount": 449,
  "uvp_currency": "EUR",
  "uvp_source_url": "https://www.lichtblick-frankfurt.de/Gavita-Master-Controller-EL2-F-Gen-2",
  "uvp_source_type": "retailer",
  "uvp_source_date": "2026-06-28",
  "uvp_confidence_level": "C",
  "uvp_notes": "German retailer (Lichtblick Frankfurt) €449 incl. 19% VAT. EU retailer led-grower.eu lists at €359.96 incl. VAT.",
  "notes": "EU/UK-specific model with EC fan control (PID algorithm). US equivalent is EL2 Gen 2 (SKU HGC906121, ASIN B093QRNCX8 on Amazon.com). EL2F = 2 independent channels; EL1F = 1 channel. ECM modules sold separately for schedule-based CO2/heater switching. Gen 2 uses 15V DC adapter (Gen 1 used 5V). Up to 6 B200 booster modules supported for extended repeater bus (up to 1000 fixtures). EAN: 3701058832052. Dimming range 50–115% in 10W increments."
}